"Bug ID","Product","Component","Assignee","Status","Resolution","Summary","Changed"
229,"Other","Configuration","zippel","REJECTED","DUPLICATE","diffsrv URL changed","2003-01-05 16:17:28"
865,"Other","Configuration","zippel","REJECTED","UNREPRODUCIBLE","quota support new format is not compiled by default","2003-07-07 02:54:59"
881,"Other","Configuration","zippel","REJECTED","DOCUMENTED","xconfig or gconfig not working correctly","2003-07-07 03:21:46"
946,"Other","Configuration","zippel","REJECTED","WILL_NOT_FIX","Importing .config from 2.4.21 creates uncomplete .config in 2.6.0","2003-07-21 01:50:09"
971,"Other","Configuration","zippel","REJECTED","INVALID","Make xconfig fails if /usr/include/asm is a link to kernel include/asm","2003-07-21 01:34:07"
1175,"Other","Configuration","zippel","REJECTED","WILL_NOT_FIX","Davicom 9102 setting not converted when using make oldconfig","2003-09-15 06:47:38"
1223,"Other","Configuration","zippel","REJECTED","UNREPRODUCIBLE","Menuconfig freeze","2004-02-25 16:32:09"
1850,"Other","Configuration","zippel","REJECTED","INSUFFICIENT_DATA","'make xconfig' broken","2004-01-18 09:12:29"
2038,"Other","Configuration","zippel","REJECTED","INVALID","It fails menuconfig and xconfig on SuSE 9","2004-02-09 01:57:20"
2049,"Other","Configuration","zippel","REJECTED","INVALID","Cannot make config/xconfig/menuconfig","2004-02-09 01:55:54"
2197,"Other","Configuration","zippel","REJECTED","INVALID","make xconfig - trying to assign nonexistent symbol","2004-02-25 16:29:03"
2235,"Other","Configuration","zippel","REJECTED","UNREPRODUCIBLE","menuconfig screen gets blank (menu options dont appear), while executing a ""make menuconfig"" command","2004-05-10 12:20:35"
2585,"Other","Configuration","zippel","REJECTED","INSUFFICIENT_DATA","make gconfig produce error","2004-09-12 11:26:41"
3790,"Other","Configuration","zippel","REJECTED","WILL_NOT_FIX","Enhancement for navigating menuconfig/xconfig","2005-05-18 18:35:26"
4782,"Other","Configuration","zippel","REJECTED","WILL_NOT_FIX","Missing help entries in ""make menuconfig""","2005-07-26 15:53:49"
4937,"Other","Configuration","zippel","REJECTED","WILL_NOT_FIX","Open Sound System (DEPRECATED) (NEW)","2005-07-26 15:28:21"
4938,"Other","Configuration","zippel","REJECTED","WILL_NOT_FIX","Make menuconfig module descriptors disappear when selection changes","2005-07-26 15:25:16"
5158,"Other","Configuration","zippel","REJECTED","DOCUMENTED","ps/2 keyboard on x86_64 does not work as module in 2.6.13-rc6","2008-03-10 20:40:31"
5781,"Other","Configuration","zippel","REJECTED","INVALID","make oldconfig or menuconfig fails with","2006-01-04 09:41:40"
6008,"Other","Configuration","zippel","REJECTED","INVALID","Compile bugfix Kbuild.include","2006-02-04 15:54:28"
6065,"Other","Configuration","zippel","REJECTED","INVALID","Feature request for qconf / make xconfig: Visible module option","2006-06-20 07:29:45"
6451,"Other","Configuration","zippel","REJECTED","WILL_NOT_FIX","CONFIG_KMOD is not set for x86_64 but is set to Y for i386 and other archs","2006-06-20 08:54:50"
6459,"Other","Configuration","zippel","REJECTED","WILL_NOT_FIX","non-existant make target should recognized earlier","2006-06-20 07:38:21"
6482,"Other","Configuration","zippel","REJECTED","INVALID","USB -UPS Problem on FC5","2006-05-03 07:41:48"
6528,"Other","Configuration","zippel","REJECTED","WILL_NOT_FIX","make menuconfig on stock kernel produce ~20 warnings about nonexistent symbols (x86 only ?)","2006-07-15 14:18:17"
6952,"Other","Configuration","zippel","REJECTED","WILL_NOT_FIX","wish: qconf feature - presets for kernel compilation","2007-10-04 08:54:02"
7382,"Other","Configuration","zippel","REJECTED","INSUFFICIENT_DATA","Missing file version.h","2006-12-03 06:56:16"
7497,"Other","Configuration","zippel","REJECTED","INVALID","FC6 x86_64: skipping incompatible /usr/lib/libmng.so when searching for -lmng","2006-11-15 17:04:03"
429,"Other","Other","zwane","REJECTED","WILL_NOT_FIX","Device names cut off in /proc/ioports and other places","2003-04-18 23:45:45"
638,"Other","Other","zwane","REJECTED","INSUFFICIENT_DATA","can't boot into kernel version 2.5.68","2003-05-31 16:11:19"
822,"Other","Modules","zwane","REJECTED","INSUFFICIENT_DATA","accessing some devices does not make kmod to load the modules","2003-11-12 22:26:27"
940,"Other","Other","zwane","REJECTED","INVALID","Kernel hangs directly after ""Booting the kernel"".","2003-07-17 02:12:41"
1010,"Other","Other","zwane","REJECTED","WILL_NOT_FIX","lcd video scale reset at boot","2005-08-07 13:47:41"
1312,"Other","Other","zwane","REJECTED","INSUFFICIENT_DATA","System is not rebooted well","2003-10-30 16:03:29"
1460,"Other","Modules","zwane","REJECTED","INVALID","Module loading problem","2004-02-25 11:11:00"
1476,"Other","Modules","zwane","REJECTED","INSUFFICIENT_DATA","Modules which have common symbols can't be inserted.","2003-12-14 21:06:18"
1567,"Other","Modules","zwane","REJECTED","INVALID","Inconsistent (nonexistent) naming semantics for modules","2005-08-07 13:39:00"
1717,"Other","Other","zwane","REJECTED","UNREPRODUCIBLE","oops with 2.6.0 on IBM 600X","2004-06-21 13:39:01"
1802,"Other","Other","zwane","REJECTED","INSUFFICIENT_DATA","Random freeze, once every couple of days","2004-11-30 22:01:59"
1836,"Other","Other","zwane","REJECTED","UNREPRODUCIBLE","Build Failed (kernel/configs.c)","2004-06-21 13:30:55"
1906,"Other","Other","zwane","REJECTED","INSUFFICIENT_DATA","VNC server crash randomly","2005-04-24 08:37:54"
2198,"Other","Other","zwane","REJECTED","DOCUMENTED","__attribute_const__ undefined for gcc 2.95","2004-06-20 19:50:06"
2325,"Other","Other","zwane","REJECTED","DOCUMENTED","compiler.h header file causes non-kernel programs to fail","2004-06-20 17:49:58"
2453,"Other","Other","zwane","REJECTED","WILL_NOT_FIX","Not working ""mem="" option","2004-12-07 08:23:46"
2470,"Other","Other","zwane","REJECTED","WILL_NOT_FIX","Kernel bloat is reaching epidemic proportions . Request for x86 only tarballs","2004-06-20 17:38:55"
2480,"Other","Modules","zwane","REJECTED","INVALID","depmod: Unresolved symbols in modules","2004-06-20 16:49:04"
2598,"Other","Modules","zwane","REJECTED","INVALID","insmod: QM_MODULES: Function not implemented","2004-06-20 16:48:05"
2673,"Other","Other","zwane","REJECTED","INVALID","perror call resets the errorno variable after use (makes it point to invalid address)","2004-06-21 13:40:05"
2805,"Other","Other","zwane","REJECTED","INVALID","Unresolved Symbols in RAID","2004-10-07 14:14:32"
2844,"Other","Other","zwane","REJECTED","INVALID","typo in Makefile at target modules_install","2004-06-20 21:26:37"
3079,"Other","Other","zwane","REJECTED","INVALID","lots of graphics rendering on nvidia tnt2 card causes badness","2004-08-04 09:43:19"
4525,"Other","Other","maneesh","DEFERRED","WILL_FIX_LATER","Kdump fails to boot into panic kernel on kernel panic","2007-11-17 23:54:58"
189701,"Other","Bug Tracker","bugme-admin","NEEDINFO"," ---","bios block","2021-07-04 09:19:37"
74211,"Other","Configuration","other_configuration","NEEDINFO"," ---","[PATCH]allow xconfig to build without Qt3Support","2014-05-20 06:12:06"
204279,"Other","klibc/kinit","other_klibc-kinit","NEEDINFO"," ---","uniq bug","2019-12-11 17:03:51"
61141,"Other","Other","other_other","NEEDINFO"," ---","kernel 3.11 on opensuse 13.2 fails on laptop with multiple monitors attached","2013-11-13 15:05:22"
67851,"Other","Other","other_other","NEEDINFO"," ---","kernel panic at shutdown or reboot","2013-12-30 14:54:51"
71161,"Other","Other","other_other","NEEDINFO"," ---","Kernal Panic occours randomly","2014-03-10 22:24:29"
77961,"Other","Other","other_other","NEEDINFO"," ---","CPU 5: Machine Check Exception: 5 Bank 4: be00000000800400","2015-01-13 21:24:34"
82421,"Other","Other","other_other","NEEDINFO"," ---","su fails","2014-09-14 05:12:32"
85921,"Other","Other","other_other","NEEDINFO"," ---","Hangs When Formatting an MDADM RAID0 or RAID10 with XFS","2014-10-23 14:36:16"
196859,"Other","Other","other_other","NEEDINFO"," ---","kernel tried to execute nx-protected page - exploit attempt (uid 0)","2017-12-11 08:07:48"
209391,"Other","Other","other_other","NEEDINFO"," ---","System does not resume after suspend since kernel 5.5; acpi_sleep=s3_beep does not produce beeping(BIOS suspected)","2020-12-31 08:31:13"
215409,"Other","Other","other_other","NEEDINFO"," ---","Performance and Configuration Issues with 5.15.11 Kernel","2022-01-17 01:18:41"
215455,"Other","Other","other_other","NEEDINFO"," ---","Linux Kernel 5.13.0-23 Slows everything","2022-01-06 11:23:34"
215743,"Other","Other","other_other","NEEDINFO"," ---","5.16.14 built on Centos6 with make binrpm-pkg, but 5.16.17 fails with identical configure","2022-04-02 00:29:17"
11882,"Other","Other","a.p.zijlstra","CLOSED","CODE_FIX","dbench 15% regression with 2.6.28-rc1","2008-11-09 09:46:33"
11512,"Other","Configuration","adobriyan","CLOSED","CODE_FIX","sort-of regression due to ""kconfig: speed up all*config + randconfig""","2008-10-26 11:40:11"
11854,"Other","Other","adobriyan","CLOSED","CODE_FIX","v2.6.28-rc1: readlink /proc/*/exe returns uninitialized data to userspace","2009-03-08 05:09:03"
13341,"Other","module-init-tools","adobriyan","CLOSED","OBSOLETE","BUG: unable to handle kernel paging request at 000[cd]?a0b (or 000[cd]?a1f)","2012-06-07 10:39:30"
10629,"Other","Other","akpm","CLOSED","CODE_FIX","2.6.26-rc1-$sha1: RIP __d_lookup+0x8c/0x160","2008-07-10 13:50:38"
11569,"Other","Other","andi-bz","CLOSED","CODE_FIX","Panic stop CPUs regression","2010-10-07 18:40:07"
8765,"Other","Other","anton.salikhmetov","CLOSED","PATCH_ALREADY_AVAILABLE","NULL pointer dereference triggered by ptrace","2007-11-01 06:14:31"
11793,"Other","Other","arjan","CLOSED","PATCH_ALREADY_AVAILABLE","irqbalance segfaults","2008-10-21 09:36:42"
13181,"Other","Other","axboe","CLOSED","CODE_FIX","Crash in v2.6.30-rc3 (regression from 30-rc2)","2009-05-13 10:41:53"
10250,"Other","Configuration","azummo-kernelbugzilla","CLOSED","CODE_FIX","make menuconfig help actualization needed","2008-03-15 10:37:21"
8615,"Other","Bug Tracker","bugme-admin","CLOSED","CODE_FIX","test bug to test upgraded bugzilla","2007-06-11 14:53:31"
8825,"Other","Bug Tracker","bugme-admin","CLOSED","INVALID","Sysem clock runs too slow","2008-11-13 03:48:16"
8905,"Other","Bug Tracker","bugme-admin","CLOSED","CODE_FIX","Search by kernel version doesn't work","2007-08-20 11:23:43"
9071,"Other","Bug Tracker","bugme-admin","CLOSED","CODE_FIX","Bugzilla doesn't turn HTTP URLs in comments into clickable links","2007-09-26 12:48:48"
10005,"Other","Bug Tracker","bugme-admin","CLOSED","DUPLICATE","2.6.25-rc2 wpa_supplicant segfault and causes kernel panic","2008-02-19 16:08:09"
10098,"Other","Bug Tracker","bugme-admin","CLOSED","CODE_FIX","Can't search for REOPENED","2008-02-25 12:42:46"
10441,"Other","Bug Tracker","bugme-admin","CLOSED","INVALID","testets","2008-04-11 08:12:49"
10832,"Other","Bug Tracker","bugme-admin","CLOSED","CODE_FIX","test close","2008-05-29 16:07:11"
10833,"Other","Bug Tracker","bugme-admin","CLOSED","CODE_FIX","test close again","2008-05-29 16:21:44"
11376,"Other","Bug Tracker","bugme-admin","CLOSED","CODE_FIX","Link to Bug Filing FAQ broken","2008-09-02 10:06:53"
11494,"Other","Bug Tracker","bugme-admin","CLOSED","CODE_FIX","Haute Secure claims they found ""infection"" on http://bugzilla.kernel.org/attachment.cgi","2008-09-22 09:55:35"
11755,"Other","Bug Tracker","bugme-admin","CLOSED","INVALID","Impossible to install new kernel after compiling with debian mode (2.6.27)","2008-10-15 05:55:00"
12143,"Other","Bug Tracker","bugme-admin","CLOSED","CODE_FIX","Chenge default assignee of group Other/Configuration","2008-12-17 10:54:28"
13174,"Other","Bug Tracker","bugme-admin","CLOSED","UNREPRODUCIBLE","Bugzilla doesn't respond after committing changes","2012-05-30 16:28:27"
14729,"Other","Bug Tracker","bugme-admin","CLOSED","OBSOLETE","Compile failure with gcc 3.4.6 - start_kernel in paravirt.h","2012-06-18 13:01:15"
20392,"Other","Bug Tracker","bugme-admin","CLOSED","WILL_NOT_FIX","Request for detailed statistics","2012-05-17 15:57:42"
23262,"Other","Bug Tracker","bugme-admin","CLOSED","INVALID","Bugzilla shows stale information in bug lists","2010-11-18 23:33:45"
81481,"Other","Bug Tracker","bugme-admin","CLOSED","INVALID","fasasf","2014-11-03 18:37:50"
10405,"Other","Configuration","devzero","CLOSED","PATCH_ALREADY_AVAILABLE","""BATTERY_OLPC"" depends on nonexistent ""OLPC""","2008-05-12 04:57:40"
11151,"Other","Modules","devzero","CLOSED","INVALID","Add dazuko module","2008-08-02 15:13:43"
13249,"Other","Other","dri-devel","CLOSED","OBSOLETE","Intel 945GM: Boot option`vga=0x31a' breaks display of TTYs","2012-06-07 10:23:33"
11501,"Other","Configuration","dwmw2","CLOSED","DUPLICATE","Failed to open destination file: Permission deniedihex2fw","2008-09-22 15:02:00"
11801,"Other","Modules","dwmw2","CLOSED","WILL_NOT_FIX","sudo make modules_install creates firmware files owned by root","2012-06-21 21:54:36"
41132,"Other","Other","edward.donovan","CLOSED","CODE_FIX","[BISECTED][REGRESSION] Regression with the IRQ subsystem introduced in 2.6.39 (and present in the 3.x version)","2012-02-14 04:10:29"
9335,"Other","Other","greg","CLOSED","CODE_FIX","system hangs after a few minutes","2007-12-17 14:29:42"
12054,"Other","Other","gregory.haskins","CLOSED","PATCH_ALREADY_AVAILABLE","exclusive cpusets are not causing unique root-domains","2008-11-24 08:06:12"
10287,"Other","Modules","herbert","CLOSED","INVALID","padlock_sha module dies when mounting CIFS share (gPC - everex tc2502 - via c7-d)","2008-03-20 04:40:16"
13474,"Other","Other","jaswinder","CLOSED","CODE_FIX","Oops whilst booting","2009-06-09 11:39:15"
32922,"Other","Other","kernel-bugs","CLOSED","CODE_FIX","futex_wait() may ignore the timeout if interrupted by a signal","2012-06-13 15:04:36"
13567,"Other","Configuration","max","CLOSED","OBSOLETE","make deb-pkg produces instalation scripts that fail to run with Ubuntu Karmic","2012-06-08 12:05:21"
195477,"Other","Other","mcgrof","CLOSED","OBSOLETE","firmware_class: loading the same file multiple times in parallel finishes only one","2019-05-23 05:31:47"
9857,"Other","Configuration","mingo","CLOSED","CODE_FIX","Compilation errors with certain options in .config","2008-01-31 12:59:46"
12838,"Other","Modules","minyard","CLOSED","INVALID","ipmi_si does not find anything on PowerEdge 2500","2009-04-07 14:34:53"
9641,"Other","Other","nhorman","CLOSED","CODE_FIX","kexec userspace utilities cannot handle a kernel command line longer than 256 chars","2008-03-05 05:22:12"
11097,"Other","Other","oleg","CLOSED","CODE_FIX","INFO: recursive lock - when I press SysRQ+powerOff","2013-04-09 06:23:26"
12443,"Other","Configuration","other_configuration","CLOSED","INVALID","make fails when patched to 2.6.29-rc1 on x86_64","2009-01-13 11:14:01"
12597,"Other","Configuration","other_configuration","CLOSED","CODE_FIX","Kernel should be built with -fwrapv","2009-03-23 08:52:03"
13409,"Other","Configuration","other_configuration","CLOSED","WILL_NOT_FIX","ACPI_VIDEO option very confusing","2012-06-08 11:26:58"
13465,"Other","Configuration","other_configuration","CLOSED","DOCUMENTED","system hangs on boot right after after mounting (/), freeing kernel memory & starting init","2012-06-08 11:37:45"
13543,"Other","Configuration","other_configuration","CLOSED","WILL_NOT_FIX","weird behavior of /proc/net/dev","2009-07-08 14:39:57"
13677,"Other","Configuration","other_configuration","CLOSED","CODE_FIX","check-lxdialog.sh mixes wide ncurses library with non wide (narrow) ncurses headers","2012-06-12 10:18:51"
14009,"Other","Configuration","other_configuration","CLOSED","OBSOLETE","Problems with compiling 2.6.30.4","2012-06-13 15:23:29"
14701,"Other","Configuration","other_configuration","CLOSED","CODE_FIX","make localmodconfig can't find lsmod","2012-06-18 12:47:05"
14804,"Other","Configuration","other_configuration","CLOSED","OBSOLETE","fs/built-in.o In function lbmLogInit","2012-05-14 15:51:48"
14902,"Other","Configuration","other_configuration","CLOSED","CODE_FIX","Boot ends not on tty1","2010-01-10 22:28:28"
14903,"Other","Configuration","other_configuration","CLOSED","INVALID","Kernel panic - not syncing: Attempted to kill init!","2010-01-13 21:54:24"
14907,"Other","Configuration","other_configuration","CLOSED","CODE_FIX","Commit ""kbuild: fix bzImage build for x86"" breaks build","2010-01-14 20:35:35"
15343,"Other","Configuration","other_configuration","CLOSED","CODE_FIX","typo in help of PAGE_POISONING","2012-05-12 13:36:47"
16595,"Other","Configuration","other_configuration","CLOSED","CODE_FIX","2.6.34.4 compilation failed","2012-05-12 16:15:31"
21302,"Other","Configuration","other_configuration","CLOSED","INVALID","Environment handling in the console","2012-05-12 15:44:09"
22112,"Other","Configuration","other_configuration","CLOSED","WILL_NOT_FIX","A couple of Kconfig warnings","2010-11-18 23:08:15"
42988,"Other","Configuration","other_configuration","CLOSED","INVALID","Complex SMP kernel with spinlock. Is it a danger?","2012-05-12 02:00:54"
43082,"Other","Configuration","other_configuration","CLOSED","INVALID","sysctl.conf values not loaded properly on boot up","2012-05-12 01:06:27"
44941,"Other","Configuration","other_configuration","CLOSED","INVALID","Kernel 3.4.6 compilation failed","2012-07-23 07:30:33"
51311,"Other","Configuration","other_configuration","CLOSED","CODE_FIX","ERROR: ""kernel_stack_pointer"" [arch/x86/oprofile/oprofile.ko] undefined!","2018-06-27 00:58:14"
54441,"Other","Configuration","other_configuration","CLOSED","INVALID","build 3.8.0 in CentOS with gcc 4.1.2 make : internal compiler error","2018-06-27 20:21:04"
90361,"Other","Configuration","other_configuration","CLOSED","INVALID","Simple typo in fs/nfs/Kconfig file","2018-06-27 00:55:44"
97571,"Other","Configuration","other_configuration","CLOSED","INVALID","Some DRM drivers/submenus are not displayed in menuconfig","2018-06-27 00:56:47"
99071,"Other","Configuration","other_configuration","CLOSED","CODE_FIX","removed config CONFIG_RESOURCE_COUNTERS in defconfig","2018-06-27 00:56:08"
109801,"Other","Configuration","other_configuration","CLOSED","INVALID","Live install FC23 fails on user creation","2018-06-27 00:57:52"
120141,"Other","Configuration","other_configuration","CLOSED","OBSOLETE","Unable to disable CONFIG_FW_LOADER and bad driver behavior when firmware built-in","2018-06-27 20:25:57"
156461,"Other","Configuration","other_configuration","CLOSED","CODE_FIX","nconfig: ""Warning: >>_GNU_SOURCE<< redefined""","2018-06-27 20:24:23"
196689,"Other","Other","other_configuration","CLOSED","INVALID","4.12.5 compile fails -- Error: instruction `andn' isn't supported in 16-bit mode.","2018-06-27 00:53:31"
198315,"Other","Configuration","other_configuration","CLOSED","CODE_FIX","configuration - compile SERIAL_8250 into module","2018-06-27 00:57:17"
212049,"Other","Configuration","other_configuration","CLOSED","INVALID","How many levels does the product classification in the menu bar of the website generally require?","2021-03-08 09:22:39"
12355,"Other","klibc/kinit","other_klibc-kinit","CLOSED","WILL_NOT_FIX","Kernel breaks if there is no static /dev/console","2010-01-25 14:26:46"
15271,"Other","klibc/kinit","other_klibc-kinit","CLOSED","CODE_FIX","Netbooting can lead to arbitrary commands execution","2012-05-14 17:14:51"
46281,"Other","klibc/kinit","other_klibc-kinit","CLOSED","INVALID","make bzImage ERROR - kernel::events::built-in.o:","2012-08-21 17:14:28"
13191,"Other","Loadable Security Modules (LSM)","other_lsm","CLOSED","OBSOLETE","WARNING: at drivers/char/tty_io.c:1335 => no more serial access to the machine","2012-05-30 16:29:12"
13229,"Other","Loadable Security Modules (LSM)","other_lsm","CLOSED","CODE_FIX","crypto/aes_generic.o crypto/aes_generic.c: In function ‘crypto_aes_expand_key’: crypto/aes_generic.c:283: warning: array subscript is above array bounds","2012-06-07 10:58:52"
33862,"Other","Loadable Security Modules (LSM)","other_lsm","CLOSED","INSUFFICIENT_DATA","Probably security_fixup_ops bug","2012-05-12 14:35:12"
42618,"Other","Loadable Security Modules (LSM)","other_lsm","CLOSED","INVALID","Make it possible to implement LSM as LKM","2012-05-12 02:34:42"
9013,"Other","Modules","other_modules","CLOSED","CODE_FIX","running ""pccardctl eject"" results in kernel BUG","2007-11-28 22:26:21"
9271,"Other","Modules","other_modules","CLOSED","CODE_FIX","Remove floppy module freeze","2007-12-01 15:43:15"
10920,"Other","Modules","other_modules","CLOSED","INSUFFICIENT_DATA","USB freeze. And after, if enter CTRL+ALT+F1 to access the main console all the system freeze (hang)","2012-05-22 12:34:01"
12272,"Other","Modules","other_modules","CLOSED","UNREPRODUCIBLE","at random rmmod/insmod corrupts filesystem","2010-01-25 14:18:02"
12353,"Other","Modules","other_modules","CLOSED","DOCUMENTED","Stable reproducable exception in PPP (dial-up-modem) module causes SMP systems to crash.","2012-05-24 14:09:09"
14162,"Other","Modules","other_modules","CLOSED","OBSOLETE","binfmt allows breaking out of chroots due to not respecting namespaces","2012-06-13 16:57:25"
15767,"Other","Modules","other_modules","CLOSED","DUPLICATE","Kernel does not recognize USB devices on some machines","2010-10-28 18:16:37"
15869,"Other","Modules","other_modules","CLOSED","DOCUMENTED","runaway loop modprobe char-major-5-1 while using initramfs/initrd","2012-05-13 14:37:16"
21342,"Other","Modules","other_modules","CLOSED","OBSOLETE","Failure to compile or use dm-raid4-5 in Linux Kernel","2012-05-17 15:37:54"
25122,"Other","Modules","other_modules","CLOSED","PATCH_ALREADY_AVAILABLE","Kernel hangs: Internal error: Oops: 17 [#1] PREEMPT","2020-10-17 03:33:51"
43319,"Other","Modules","other_modules","CLOSED","INSUFFICIENT_DATA","kernel SegFault","2012-06-07 10:21:29"
52861,"Other","Modules","other_modules","CLOSED","WILL_NOT_FIX","Drop Sensors read as Joysticks","2013-11-19 13:43:30"
63721,"Other","Modules","other_modules","CLOSED","INVALID","FATAL: Module bbswitch not found","2013-11-12 14:09:24"
83251,"Other","Modules","other_modules","CLOSED","CODE_FIX","Reference to $PWD in usb/gadget Makefile causes build failure with `make O=someOtherLocation`","2018-06-27 20:21:24"
8655,"Other","Other","other_other","CLOSED","PATCH_ALREADY_AVAILABLE","Section mismatch at compiling","2007-06-25 00:28:36"
8773,"Other","Other","other_other","CLOSED","CODE_FIX","AT_VECTOR_SIZE not big enough for some platforms with binfmt 'c/o' option","2008-09-23 05:30:22"
8998,"Other","Other","other_other","CLOSED","CODE_FIX","Mutex documentation is unclear about bottom halves, tasklets and timers","2007-10-19 17:48:46"
9020,"Other","Other","other_other","CLOSED","CODE_FIX","atomic_ops.txt has incorrect, misleading and insufficient information","2007-10-19 22:18:10"
9098,"Other","Other","other_other","CLOSED","CODE_FIX","""make rpm"" in error","2007-09-28 19:10:11"
9378,"Other","Other","other_other","CLOSED","CODE_FIX","uml doesn't work on 2.6.24-rc2","2007-11-16 15:35:48"
9398,"Other","Other","other_other","CLOSED","CODE_FIX","BUG: soft lockup detected on CPU#0!","2007-11-26 12:35:57"
9674,"Other","Other","other_other","CLOSED","CODE_FIX","Oops during rmmod'ing modeuls sdhci, sr_mod, ricoh_mmc, mmc_core","2008-01-03 14:59:13"
9850,"Other","Other","other_other","CLOSED","PATCH_ALREADY_AVAILABLE","a7839e96 (PNP: increase max resources) breaks my ALSA intel8x0 sound card","2008-03-12 22:11:51"
9932,"Other","Other","other_other","CLOSED","CODE_FIX","Local root privilege escalation - exploit already available - 2.6.23 2.6.24","2008-05-03 11:22:03"
9952,"Other","Other","other_other","CLOSED","DUPLICATE","2.6.25-rc1: Lguest build failure","2008-02-13 15:49:38"
9962,"Other","Other","other_other","CLOSED","CODE_FIX","mount: could not  find filesystem","2008-03-31 04:40:44"
9974,"Other","Configuration","other_other","CLOSED","OBSOLETE","different section mismatch on 2.6.25-rc1-git2","2012-05-12 01:18:43"
9986,"Other","Other","other_other","CLOSED","CODE_FIX","fix module_update_markers() compile error","2008-02-17 09:33:17"
10018,"Other","Other","other_other","CLOSED","CODE_FIX","CRYPTO_NULL must select CRYPTO_BLKCIPHER","2008-02-20 00:18:13"
10041,"Other","Other","other_other","CLOSED","WILL_NOT_FIX","2.6.25-rc1/2 regression: first-time login into gnome fails","2008-03-26 15:10:01"
10080,"Other","Other","other_other","CLOSED","CODE_FIX","2.6.25-rc2: ohci1394 problem (MMIO broken)","2008-03-27 14:17:56"
10164,"Other","Other","other_other","CLOSED","CODE_FIX","ntfs build failure on no-mmu","2008-03-14 00:23:55"
10200,"Other","Other","other_other","CLOSED","CODE_FIX","crypto/ section fixes","2008-03-09 17:26:50"
10489,"Other","Other","other_other","CLOSED","OBSOLETE","Kprobe smoke test lockdep warning","2012-05-21 15:07:08"
10557,"Other","Other","other_other","CLOSED","CODE_FIX","[regression] latest git couse kernel oops.","2008-05-25 04:54:12"
10674,"Other","Other","other_other","CLOSED","CODE_FIX","/proc/kallsyms broken in 2.6.26-rc1-git6","2008-05-19 14:15:10"
10728,"Other","Other","other_other","CLOSED","DOCUMENTED","Booting pauses for about 30 seconds on Acer Aspire 5710Z","2012-05-21 15:26:16"
10830,"Other","Other","other_other","CLOSED","CODE_FIX","two different oopses with 2.6.26-rc4","2008-06-22 12:32:49"
10892,"Other","Other","other_other","CLOSED","OBSOLETE","Sometime (often) X come out blank (black screen) on cold boot - Intel chipset","2012-05-12 16:29:35"
10955,"Other","Other","other_other","CLOSED","UNREPRODUCIBLE","v2.6.26-rc7: BUG task_struct: Poison overwritten","2010-01-19 18:20:55"
11068,"Other","Other","other_other","CLOSED","CODE_FIX","LATEST-IS-2.6.25.* still points to .9","2021-10-21 09:44:35"
11118,"Other","Other","other_other","CLOSED","CODE_FIX","LATEST-IS-* outdated, duplicate","2008-07-25 00:03:02"
11152,"Other","Other","other_other","CLOSED","INSUFFICIENT_DATA","Kprobe smoke test lockdep warning","2010-01-19 20:04:02"
